veda,hier,verse,meaning,elu,pu
Rigveda,1.4.1,Suruupakritnumutaye sudughaamiva godhuhe  Jjuhuumasi dyavidyavi," Suruupakritnum : Supreme Creator who created all objects, God utaye : for knowledge sudughaamiva  : just as mother cow is milked godhuhe : by a person in need of nourishment juhuumasi : we worship and glorify Him dyavi dyavi : every day regularly.   None None None None None None"," Why do we worship and glorify God? When can we worship and glorify God? We invoke the Supreme Creator of all objects i.e. God. Just as a cow-boy milkes his mother cow whenever he needs milk for nourishment, similarly we worship and glorify the Almighty Supreme Creator, any time and at any place, every day to obtain nourishment for our soul. Great knowledge and God realisation are the nourishments for our soul. Just as cow is available all the times everyday for physical and economic needs and that is why she is worshipped as mother. Similarly, God is also available at all times for worship, for seeking knowledge and to progress on spiritual path.  "," Can we also be glorified like God? The Supreme Power, God, is for spiritual progress. Cow is for physical and economic progress. That is why both are liable to be worshipped any time. If you are available to your family, society or work establishments every time for help or service, you will also be worshipped and glorified like God and cow. You can become God by serving the people around you unconditionally. Be a milking cow for others - sudughaamiva  godhuhe.   "
Rigveda,1.4.2,Upa nah savanaa agahi somasya somapaah piba  Godaa id revato madah," Upa nah : Near us savanaa : to give light to the objects, with sun rays, to bless sacrifices i.e. yajna agahi : please come somasya : being the Creator of all objects, knowledge and virtues somapaah : being the protector of all such things in us piba : we receive godaa : giving cow etc. in donation, sun rays empowering our eyes to see id : with this determination, with this power revato : people possessing objects, knowledge and virtues madah : enjoy (His grants)   None None"," How are the powers of God innumerable? God is the Creator and Protector of all objects as well as empowers us to use His grants. The Supreme Creator, God, by giving light to all objects with his sun rays and to bless our sacrifices and welfare activities, come to us. We invite Him to be with us always in our realisation. He is the creator as well as protector of all objects, knowledge and virtues in and around us. Human beings are instructed to enjoy all such possessions while sharing with others. God illumines the objects with His sun rays and at the same time empower our eyes also with the same sun rays to enjoy these objects.  "," How can we ensure long-lasting enjoyments of His Grants?  God is the Creator and Protector of every thing. Moreover, we enjoy His creation with the powers given by Him. To make such enjoyments permanent in life, we must be prepared to sacrifice such grants any time for the welfare of others. That will be actual and long-lasting enjoyment. Godaa id revato madah - only grantor becomes God. Be a grantor like God.   "
Rigveda,1.4.3,Athaa te antamaanam vidyaama sumatinaam Maa no atikhya aagahi," Athaa : Hence te : Your antamaanam : very close, feeling You in their heart vidyaama : competent to know You sumatinaam : behaving in a noble way maa : please don't no : for us atikhya : stop Your closeness, Your knowledge and virtues aagahi : You please enlighten our inner life also with your presence and realisation   None None None"," How can you become great like other great men? There were great rishis and saints who realised the presence of God very close to them, in their inner life. They were competent to know Him. They behaved in a great noble way. Similarly we also pray to God - not to stop such feelings, knowledge and virtues from us. We too can realise God, the Divine Power of the universe. We will have to follow those rishis and saints who realised God. (i) We must make efforts at our own by adopting all such qualities of great men, (ii) We must seek guidance and support from the company of such great men.  "," How to touch heights in material and social life? There are two ways to realise God : (i)   	Direct perception, (ii) 	Company of great men, practically following great scriptures like Vedas. You can follow the same principle for material and social progress also : (i) Start serving the society directly wherever possible according to your capabilities, capacity and position. (ii) Seek the guidance and support of those who are already at the height of serving others. Your destination in life certainly should be to touch the height in your respective field.   "
Rigveda,1.4.4,Parehi vigram astritam indram pricchaa vipashchitam Yaste sakhibhya aavaram," Parehi : Keeping away from worldly issues vigram : noble intellectuals astritam : non-violent, virtuous indram : holding divinity, controll over sense organs pricchaa : go and ask ( your querries) vipashchitam  (vi + pash + chittam) : who have understood and realised God and His powers in their heart. Yah : who are te : for You and sakhibhya : Your equal minded friends, seekers of divinity aavaram : providers of Divine knowledge that is liable to be adopted, acquired and held.   None None"," Features of great realised souls? If we are seekers of spirituality and divine knowledge, it is advisable to first keep our self away from worldly desires and then to seek the company of such great souls who have following features : (i) noble intellectuals (ii) non-violent, virtuous (iii) holding divinity (iv) understood and realised God and His powers in their hearts. Only such people can provide proper guidance on the divine path.  "," Features of a good advisor? Whether it is regarding divine path or any worldly issues, advices must be sought from a person of proper caliber, competence and whose behaviour must be free from doubts. This verse lays down four features of a great advisor : (i) noble intellectuals having complete knowledge of the subject matter. (ii) non-violent, virtuous (iii) holding divinity, purity, welfare orientation (iv) understood and realised the knowledge of his subject in his heart.  "
Rigveda,1.4.5,Uta bruvantu no nido niranyatashchidaarata Dadhaanaa indra id duvah,  Uta : Certainly with determination bruvantu : speak no : not nido : criticism nih aarata : keep away from anyatah : other useless jobs and discussions chid : certainly Dadhaanaa : hold indra : God id : certainly duvah : discussions about  ," What are three great instructions to progress on spiritual path? Three practical instructions to progress on spiritual path : (i) No criticism of others in their absence : We must refrain from criticizing others at their back and even in one's presence. We should point out faults very humbly to look like a suggestion for his/her welfare. It is believed that if we criticize a wrong-doer, his wrong deeds are added to our karma bank also. It amounts to wastage of our energy. (ii) No involvement in useless jobs or gossip discussions. Focus on the utility of time and energy for useful activities only. (iii) Always hold discussions about God, the Supreme Energy and your individual life energy, health and welfare of all.  "," What are three great practical instructions for peace and progress in life? These three instructions are universal in nature irrespective of our place, time or pursuits, may it be our home, workplace, society or spiritual path. (i) No criticism (ii) Focus on useful spending of time and energy. (iii) Discussions about energizing and promoting welfare. This would increase our energy level, utility of our efforts would increase and save us from many complications like grouping, ego problems and conflicts etc. Such a person is appreciated everywhere and by everyone.  "
Rigveda,1.4.6,Ut nah subhagaan arirvocheyuhdasma krishtayah Syaamedindrasya sharmaani , Ut : Also nah : our subhagaan : praises (for our acts and virtues) arih : by enemies vocheyuh : be sung dasma : O! the Supreme Lord giving punishment to wrong-doers krishtayah : be a hard working person (working with a happy and balanced mind) syaam : inspired and established it : with determination indrasya : in God's sharmaani : permanent pleasure   None," What are the results of three great instructions? This verse is to be read with verse 5 of this sukta. If we follow three practical instructions to progress on spiritual path i.e. not criticizing others, focusing on utility of time and energy, always discussing about God, the Supreme Energy, we will be able to create an atmosphere where even our enemies would also appreciate us and sing songs in our glory. Wrongs of others are not our problems. The Almighty God punishes every wrong-doer. We should focus only on our acts. We can work hard with a balanced mind only if we don't involve in gossips and useless activities. This way we can establish our self in permanent pleasure of God with our determination.  "," What is the plan for permanent pleasure? Three requirement : (i) No criticism (ii) Focus on doing useful acts only. (iii) Always discuss about Supreme Energy  Three results : (i) Your enemies will praise you (ii) You will become hard worker with balanced mind (iii) You enjoy the permanent pleasure of your inner energy.   Principle :	Only God punishes wrong-doers, not we or our comments.    "
Rigveda,1.4.7,Emaashumaashave bhara yajnashriyam nrimaadanam  Patayanmandayat sakham,"Em : These aashum : objects of speed and other qualities, virtues aashave : for realising God, for achieving splendid wealth bhara : hold yajnashriyam : great fame of a noble person doing good to others nrimaadanam : giving joy to the progressive person Patayat : owner's feeling mandayat : joyous feeling sakham : like a friend   None None None None"," What is the purpose of all objects and virtues? We should hold all worldly objects made of five elements (ether, air, fire, water and earth) and virtues etc. for the realisation of God, the Supreme well wisher and the Giver of everything. These objects and virtues are the cause of our fame when we use them for the welfare of others i.e. yajna. These objects and virtues are the cause of joy in the life of progressive person. On one hand, these objects and virtues give us a feeling of being the owner thereof and on the other, their presence is joyous like a friend. But we must remember every moment that the purpose of all the objects and virtues in our life is God realisation.  "," We must hold all objects and virtues keeping in mind the following : (i) For doing welfare activities, (ii) they give great fame, (iii) they give great joy, (iv) they give us a feeling of being an owner, (v) they look like our a friend, (vi) purpose of all these is God realisation   "
Rigveda,1.4.8,Asya pitvaa shatakrato ghano vritraanaamabhavah Praavo vaajeshu vaajinam," Asya pitvaa : After consuming these shatakrato : performer of innumerable tasks ghano : clouds vritraanaam abhavah : become the killer of all evils, diseases etc. Praavo : protect vaajeshu : in this war of life vaajinam : the protectors, warriors   None None None None None"," Who is protected by God? The Almighty Supreme Power, God, performs innumerable tasks in the universe. Through His great creation Sun, He drinks the clouds and thereby produces rain to kill diseases and produce all nutrition. Similarly, active and intelligent people drink the nectar of God realisation by performing penances to kill the evil minds and to produce virtues. Strong and able bodied warriors drink the sufferings and miseries of others to kill criminal and evil minds and to protect innocent people. The Supreme Lord protects all such intelligent and powerful people who sacrifice their interests and take upon their shoulders, the responsibility of protecting common people.  "," Protection is the universal requirement of Divinity. God protects those who protect virtues. This golden rule has universal application. In families, everyone love the head of family who works for the smooth running of everyone's life. At work places and in the society, all superior authorities and leaders are respected because they protect their respective juniors and masses as well. Great people use their authority for the welfare of others even at the cost of their personal interests and conveniences. It is required by the Divinity.   "
Rigveda,1.4.9,Tam tvaa vaajeshu vaajinam vaajyaamah shatakrato Dhanaanaamindra saataye," Tam tvaa : To You (the Shatakrato) vaajeshu : in this war of life vaajinam : the Supreme Protector, Warrior vaajyaamah : we try to know and realise shatakrato : the performer of innumerable tasks Dhanaanaam : for splendid wealth indra : O! God saataye : we worship and glorify You.   None None None None", Why do we worship and glorify God? Read verse 8 and 9 together - The ultimate Protector and Performer of innumerable tasks is God whom we try to know and realise. We worship that Supreme Energetic and Powerful God.  ," By protecting others you can make your life great. The ultimate Supreme Protector is God, that is why we worship, glorify and endeavour to realise Him only. Hence, practically we you wish to make your life great, you must act and behave like protector of others.  "
Rigveda,1.4.10,Yo raayo avanirmahaantsupaarah sunvatah sakhaa Tasmaa indraaya gaayata," Yo : Who raayah : splendid wealth - material, mental and spiritual avanih : produces and provides mahaanta : is liable to be worshipped and glorified for His Greatness supaarah : He facilitates all tasks and fulfills all desires sunvatah : those doing similar welfare of others sakhaa : friend of Tasmaa : that indraaya : Supreme Power is gaayata : to be sung in praise.   None None"," What is the greatness of God? Being the Supreme Protector, God is liable to be worshipped for His greatness because :- (i) He produces and provides splendid wealth i.e. material, mental and spiritual. (ii) He facilitates all tasks and fulfills all desires. (iii) He is the friend of those doing welfare of others. Therefore, only that Supreme Power is to be sung in praise.  "," People having great wisdom, energy and helping nature are also considered great and friends of God. Just as God is Supreme in the universe, there are so many people around us, in our families, offices and in the society, who are of supreme importance in our life. Their great wisdom, energy level as well as their help and support to others made them important for many. Such people are the friend of the Supreme Energy, God. We respect and glorify all such friends of God also as if we glorify God."
