veda,hier,verse,meaning,elu,pu
Rigveda,1.2.5,Vaayuvindrashcha chetathah sutaanaam vaajiniivasuu  Taavaa yaatamupa dravat,"Vaayu indrashcha : Powers of God, air and sun, active and energetic Chetathah : hold and enlighten sutaanaam : all that is produced vaajiniivasuu : everyday morning Divine time (brahamvela) taav : both of these aayaatam upa : come near dravat : speedily   None None None None None None"," How can God be realised near us? Air and sun (consequently rain water) produce so many things in nature. By producing all those things for us, these Divine powers also come near us speedily everyday morning at Divine time. Ultimately, God by providing all objects, nobilities and knowledge remains near us every moment. Everything we touch, see or use must remind us that it is God's gift and hence God is very near us. If we take vaayu and indra to mean active and energetic person, God's presence can be realised through such person also. Such persons by serving others in a great manner everyday look like a Divine personality and attract God to be near them every moment.  "," God is near us every time Active and Energetic people feel more close to God God gives us all worldly objects and nobilities. Through these gifts, He is near us every time. Similarly, active and energetic people enjoy love and respect not only from the beneficiaries but from God also.  "
Rigveda,1.2.6,Vaayu indrashcha sunvata aayaatam upa nishkritam  Makshvitthaa dhiyaa naraa,"Vaayu indrashcha : Powers of God,  air and sun, active and energetic sunvata : produce every useful thing and protect aayaatam upa : come near us nishcritam : to purify us by granting results of our actions makshvitthaa : very soon in this way (by giving results of our acts) dhiyaa : knowledge naraa : receiver   None None None None None None"," How does God purify us? God through His Divine powers of air and sun produce all objects, knowledge etc. and remains near us to purify us by granting results of our acts, very soon and thus make us receiver of great knowledge. An active and energetic person also does good to all. He is thus, purified and gets rewards of his acts and receive Divine knowledge and favour of the Supreme Energy. God is like a teacher, who first teaches and then examines the performance of disciples to reward them suitably. In this way, the disciple is purified by that Supreme Teacher every time.   "," Active and Energetic are Purified People God controls the results of our acts just to purify us and to improve our intellect. Active and energetic people are also purified persons, loved and rewarded by Supreme Authorities.  "
Rigveda,1.2.7,Mitram huve puutadaksham varunam cha rishaadasam  Dhiyam dhritachim saadhantaam,"Mitram : Sun (energy) huve : I call/receive/accept puutadaksham : for pure strength (free from impurities and energetic) varunam cha : and air (activity) rishaadasam : to destroy evil, violent or inimical tendencies dhiyam : knowledgeable  dhritachim : evil less saadhantaam : to be achieved   None None None None None"," Can we be like sun (mitra) and air (varuna)? I call the energy of sun like a friendly power to attain pure strength, great energy free from impurities. I call air and activity to destroy all evil tendencies. Air purifies and thus destroys evils. Sun and air together produce rain to destroy impurities from earth and deliver strength. Worshipping means aspiring for qualities and powers of sun (mitra) and air (varuna), energy and activity in purest form. With such a worship, one can acquire evil less knowledge to benefit others.  "," Be a Mitra and Varuna In every society, we must have energetic and active people like mitra and varuna with pure strength and evil less activity. We ourself should try to be mitra and varuna to inspire others also to be like that.  "
Rigveda,1.2.8,Ritena mitraavarunaa ritaavridho ritsparshaa  Kratum brihantam aashaathe,"Ritena : Created by and established in the discipline of Divine Supreme Energy i.e. God mitraa varunaa : sun and air ritaavridho : are the augmenters of Divine Truth, rain and seasons ritsparshaa : are the cause of establishing contact with Divine Truth, rain kratum : yajna of universe brihantam : vast in size is aashaathe : pervaded by (both mitra and varuna   None None None None None None"," Are the sun and air also under the discipline of God? Sun and air, despite being very powerful elements in nature are created by and established in the discipline of the Supreme Power God. Spiritually, they are the augmenters of Divine truth and help in establishing a contact with that Supreme Power i.e. God. Materially, they promote rain and thus establish a contact with every thing in universe. The whole creation is like a vast yajna performed by these two powerful elements, sun and air, energy and activity. That is why, energetic and active pure persons doing all welfare for others also remain disciplined under the Supreme Authority of God. Such people are augmenters of all good for everyone. Their life is like a yajna from which everyone is benefitted.  "," Everyone to remain under the Discipline of God Powerful forces like sun and air are in the discipline of God, the Supreme force. Similarly, every energetic and active person doing all good to others should also remain subject to the discipline of the Supreme Authority whether at home or elsewhere. No one should feel supreme in himself.   "
Rigveda,1.2.9,Kavii no mitraavarunaa tuvijaata urukashayaa  Daksham dadhaate apasam,"Kavii : For realisation nah : of us mitraa varunaa : Powers of God, sun and air, energy and activity tuvijaata : doing welfare for all urukashayaa : at all places daksham : power dadhaate : holding apasam : all activities   None None None None None"," To whom has God delegated His Powers? Sun and air do welfare for everyone at all places. They are for taking us to realisation state. They are holding power for all our activities, good or bad. God has manifested His greatness through sun and air. These elements of nature actually hold all powers for our welfare only. They hold powers of God and still tolerate all good and bad activities taking place on earth. Similarly, in society some energetic and active people do welfare for all. Such people are empowered by God. Actually, it's Divinity appearing through such people. Such energetic and active people are a cover up of lesser energetic, lethargic or evil minded people in as much as they do good for all universally. On the other hand, such pure and divine people become inspiration to others sooner or later.  "," Great Tolerance Power of Energetic and Active God manifests through sun and air to perform all welfare. Sun and air despite holding all powers, tolerate our deeds, good or bad. Similarly, energetic and active persons are the Divine Powers of any establishment. They do hard work, enjoy power and still provide a cover up to others. Their tolerance is great. If they also stop their hard work, the establishments can fall down.          Rigveda Mandal-1, Hymn-3  "
Rigveda,1.3.1,Ashvinaa yajvariirisho dravatpaanni shubhaspati  Purubhujaa chanasyatam," Ashvinaa : Pair of two, (As per Maharishi Dayanand ji it fire (agni) and water (jala). As per Vedic grammer it can be (i) earth and sky, (ii) sun and moon, (iii) day and night, (iv) expert physicians or scientists. As per Harisharan Sidantalankar ji it is inhaled and exhaled breath (pran and apan) yajvarii : science of arts and crafts, person performing welfare acts with sacrifices (yajik) isha : desired materials dravatpaanni : instrumental in quickening the movement shubhaspati : giver of great virtues, benefits, great deeds purubhujaa : multi dimensional, multipurpose, taking care of many people chanasyatam : consuming with joy like food   None None None None None"," How is Ashvinaa, the pair of two, useful in life? Maharishi Dayanand ji has explained this verse to mean - Experts should make proper use of fire and water element in the science of art and craft or in food to produce desired things, so that people, after using their products, are able to quickly move from one place to another to perform various activities for general benefits. This way, large number of people would be benefitted. They will use all such things with joy as they feel while consuming food. According to Shri Harisharan ji - ashvinaa means the pair of pran and apan, the two names of inhaled and exhaled air. Air is vital element in our life. Proper use of air, inhaled and exhaled, make us moveable and active, make our efforts beneficial for many and help us digest food with joy and for proper utilization.  "," Wherever two forces join to work in a common direction and with common motive, the result would always be great and beneficial for many and also to achieve desired aims. There can be many types of pairs - husband & wife, father/mother & son/daughter, two brothers/sisters/friends, two social workers, employer & employee, partners, two soul-mates, govt. & citizens, body & mind, God & soul etc.  On spiritual path, body and mind should join together as ashvinaa to realise inner spirit and ultimately God Any joining of two forces (ashvinah) can ensure :- (i) 	welfare activities (ii)	achievement of desired aims (iii)	movement (iv)	great benefits for large number of people (v)	this joining shall be joyful like consuming good food. This verse supports a layman statement - one and one make eleven.   					"
Rigveda,1.3.2,Ashvinaa purudansasaa naraa shaviirayaa dhiyaa  Dhishnyaa vanatam girah.," Ashvinaa : Pair of two, (As per Maharishi Dayanand ji it fire (agni) and water (jala). As per Vedic grammer it can be (i) earth and sky, (ii) sun and moon, (iii) day and night, (iv) expert physicians or scientists. As per Harisharan ji it is inhaled and exhaled breath (pran and apan) purudansasaa : performing many types of acts naraa : giver of fruits of action, making us progressive shaviirayaa : helpful in movements dhiyaa : fire and water, intellect dhishnyaa : speed in movement or activity vanatam : to be utilized, beneficial girah :  sciences of art and craft, intellectual efforts   None None None None"," If we take the pair of fire and water to mean ashvinaa, the meaning of this verse is - This pair, as a great science, has power to perform many great acts resulting in good fruits, helpful in movements with speed, to be utilized in many beneficial acts.  "," A pair with all sincerity and sharp intellect can do anything great. As this principle is applied to two non-living elements, so is applicable in mutual relationship of living beings too. Even on spiritual path, one has to unite his physical and mental powers to realise inner power of God.   "
Rigveda,1.3.3,Dasraa yuvakavah sutaa naasatya vrikta barhishah  Aayatam rudravartanii ," Dasraa : Destroyer of miseries, sufferings yuvakavah : unitedly as a mix or separately sutah : proper and full use of elements or powers naasatya : nothing is untruthful in them vrikta barhishah : the great learned people who explain the result of united action aayatam : let them come to us rudravartanii : to destroy enemies   None None None None None"," How great are the results of united action of our powers? God instructs us to make proper and full use of our powers, our abilities and elements found in nature, unitedly or separately, as per situational requirements. There shall be no untruth or lack of ability, competence or power in any element or companion.  Invite great and learned people to explain the result of united action or efforts, to destroy enemies or troubles. Such relations and activities destroy all sufferings and miseries. It means, besides the power of elements or companions, there is a great importance of learned people to guide about the proper use of elements and/or to purify the hearts and minds of companions.  "," Verse1, 2 & 3 form a common chain of one idea. Focus in the verse 3 is on proper knowledge and use of elements, purity of companions. Help of learned great men/experts is warranted in every group of people or in any activity of science.   "
Rigveda,1.3.4,Indra aayaahi chitrabhaano sutaa ime tvaayavah  Anviibhistanaa putaasah ," Indra : Almighty God, sun aayaahi : please come to us chitrabhaano : having astonishing knowledge, light sutaa : all good qualities and knowledge in us, all worldly objects ime : these tvaayavah : are produced by you and are your part and parcel, are desiring for you anviibhistanaa : by the subtlest causes spread all over and always putaasah : are pure and purifying   None None None None"," Shall we remain satisfied with the grants of God or wish for God? The Almighty God! please come to us, always be in our realisation to inspire us at every step. That Supreme Power has produced astonishing knowledge, powers and have given all these to us. Whenever we use these objects, knowledge or powers etc. we must desire for the company of the Great Giver also because all His gifts, produced by the subtlest causes, are all pure and purifying.  We should not remain satisfied with the grants of God but must aspire for His realisation. Only then we can keep our self purified. Vice versa, if we focus on purity, we can easily realise that Supreme Power.  "," Every superior authority, in any small or big establishment, gives you many benefits in the form of worldly gains, knowledge, training, honour etc. and would certainly expect in return a purity in your acts and conduct. If we show these ethics, certainly we can get closer to our superior authority.  "
Rigveda,1.3.5,Indra aayahi dhiyeshito viprajuutah sutaavatah  Upa brahmaani vaaghatah," Indra : Supreme Intelligence God, controller of sense organs aayahi : please come to us dhiya : by intellect and intelligent deeds ishitah : desired and receivable viprajuutah : enlightened people are able to know You. sutavatah : who know the worldly and spiritual sciences, protect virtues in them upa : near brahmaani : great knowledgeable and enlightened people vaaghatah : who perform welfare activities (yajna) for the happiness of all   None None None"," How can we realise nearness to God? Realisation of Supreme Intelligence of God is desired, possible and receivable only through intellect and intelligent deeds. Intellect here means subtle mind. We can activate our subtle mind for God realisation only by controlling multi waves of thoughts and selfish desires. Only enlightened people know Him as they have known all worldly and spiritual aspects of knowledge and protected virtues in them. God remains near such people only who have great knowledge and are enlightened and perform welfare activities (yajna) for all.  "," How can we achieve nearness to our superiors? We can get closer to any higher authority with our great intellect. This nearness is possible only for those possessing these features :- (i)	Who are enlightened and desiring to know more, (ii)	Who have protected virtues in them, (iii)	Who perform welfare deeds.  "
Rigveda,1.3.6,Indraa aayahi tuutujaana upa brahmaani harivah Sute dadhishva nashchanah," Indra : The air in universe, our pranic air (both the dimensions are attributable to God) aayahi : please come to us tuutujaana : quick in motion up : get near brahmaani : enlightened persons harivah : for movements, as controller of senses sute : beneficial worldly objects and great virtues dadhishva : are held nashchanah : for consuming food, its digestion and other processes, for other purposes like using materials, acquiring knowledge and practicing virtues.   None None None"," How can we realise God, by realising the importance of air? The wide spread air in the universe represents God. We welcome God in our individual life every moment as prana. It's quick in motion, so our movements and activities take place due to that air. Even Divinity comes near us for the very purpose of enlightenment and movements. Food that we consume passes through digestion and other processes for the purpose of continuity of a healthy life. With such a healthy life, everyone wishes to hold all their belongings i.e. materials, knowledge and virtues. It means all our life activities are dependent on air, a gift of God.  Thus, we can realise God on the strength of knowledge, selfless and egoless activities. We should hold these features as daily food to continue with our realised state.  "," What's the importance of air in life? Air means continuity. Without air in 3 minutes we can die. Air is important for all life activities. Just as we hold air to digest food and to perform other activities; we hold life to use all worldly objects and our virtues, similarly we should make intelligent efforts for a better future. Our higher authorities/elders made intelligent efforts in past to facilitate our present. Obviously, they would expect same intelligence and activities from us for a better future. On the strength of our intelligence and virtues, we get a status and our life processes are carried on. The purpose all life activities should be to increase our intelligence and virtues to ensure its continuance in future.   "
Rigveda,1.3.7,Omaasacharshanidhrito vishve devaasa aagata daashvaamso  Daashushah sutam," Omaasah : God's feature of protecting everything with his vast powers like knowledge, sciences, virtues, realisation etc.  charshanidhrito : holding everything with His true preachings (Vedas) vishve devaasa : all great and enlightened men who have realised God and His knowledge aa gata : please come to me (be in my realisation) daashvaamso : You can make us fearless with Your Divine qualities daashushah : give to all people sutam : knowledge of all sciences and virtues.    None None None None"," How does God protect and hold everything in the universe? Two principal features of God are :- 1. Protecting everything with His vast powers like knowledge, sciences, virtues etc. 2. Holding everything with His knowledge. So we must invite and welcome all such great people who are well versed with God's knowledge and powers. Such great people can also do two important favours to us :- 1. make us fearless, 2. give us true knowledge of all sciences and virtues etc.   ","  What is the importance of complete knowledge and expertise? Complete knowledge and expertise in any pursuit is welcomed everywhere as it is helpful in two principal ways :- 1. It removes fears of disturbances by empowerment, 2. It makes us aware of true knowledge. Therefore, everyone should be a powerful and knowledgeable personality of one's pursuit. One can have a great progressive future only if he is competent to protect others from miseries/sufferings with his complete knowledge..   "
Rigveda,1.3.8,Vishve devaaso apturah sutamaa ganta tuurnayah Usraa iva svasaraani.," Vishve devaaso : All great enlightened men who have realised God and His knowledge apturah : swift moving and acting rapidly sutamaa ganta : come regularly to enlightened us with all sciences, knowledge and virtues tuurnayah : to diffuse light of knowledge in all directions Usraa iva : as the solar rays svasaraani : come diligently in the day.   None None None None None None"," How are enlightened people equated with morning sun rays? God has ordained all people to invite and welcome those enlightened men who are swift moving to diffuse knowledge in all directions as they can better enlighten us with all sciences, knowledge and virtues. Such people are beneficial as sun rays coming diligently to diffuse light in the day. This verse can be taken as a duty cast upon all enlightened persons to be swift moving to spread knowledge. Let no trouble, desire for selfish gains, or laziness to remain as a hurdle in performing this duty. Swift movement without laziness is related to great knowledge. Whereas, luxuries and laziness are related to ignorance.  "," Why are enlightened people  respected everywhere? Always keep an active connectivity with enlightened people of your pursuit. Such people have been equated with sunrays coming for enlightenment in the day. We can not imagine a day without sunrays. Similarly, we can not imagine enlightenment, knowledge and virtues without the connectivity of already enlightened and knowledgeable people. Enlightened persons are respected everywhere. Therefore, be that enlightened or follow an enlightened.   "
Rigveda,1.3.9,Vishve devaaso asridha ehimaayaaso adruhah  Medham jushanta vahnayah.," Vishve devaaso : All great enlightened men who have realised God or His knowledge asridha : undecayed knowledge ehimaayaaso : always active (without laziness) adruhah : devoid of malice Medham : combining knowledge and action for all people jushanta : everyone should enjoy company of such people happily vahnayah : as their acts are for the happiness of all, they eagerly accept the responsibility of their duties i.e. karmas.   None None None None None"," What are the important features of enlightened people? All great enlightened persons have following features :- (i) 	Their knowledge is undecayed (asridha) (ii)	They are always active (ehimaayaaso) (iii)	They are devoid of malice (adruhah) (iv)	They combine knowledge and action for the welfare of all (medham) (v)	They eagerly accept the responsibility of their duties (vahnayah) For all followers and common people, there is only one requirement to enjoy the company of such people happily with heartfelt welcome.   ", 5 duties of Great people v/s 1 duty of Ordinary people Great and enlightened persons have 5 great responsibilities as compared to just one duty for the ordinary people i.e. to enjoy the company of enlightened person happily. Enlightened persons don't mind while performing such hard duties but ordinary people don't care for their single duty. Ordinary people don't wish anyone to help them develop Vedic Wisdom. That's the root cause of modern life's miseries and sufferings   
Rigveda,1.3.10,Paavaka nah saraswati vaajebhirvaajiniivatii  Yajyam vashtu dhiyaavasuh ," Paavaka : Purifying  nah : for us saraswati : knowledge which is great, beneficial for all and supreme vaajebhirvaajiniivatii : whatever materials are used in the attainment of knowledge, this knowledge, in return, produces materials in multiples Yajyam : welfare acts vashtu : enlightening dhiyaavasuh : combining knowledge and activity   None None None None None"," What is saraswati, the great knowledge? Only great, beneficial for all and supreme knowledge purifies us through our behaviour and conduct. Saras in hindi means - samaan rasa, equally beneficial for all. Wherever there is great and beneficial knowledge, there is purity. Otherwise it's just information and rather ignorance and can produce impurity. Whatever materials, food and other things, are consumed or invested to attain such great knowledge, it gives back all those things. This way, it becomes a cycle of great knowledge, happiness and prosperity. If some knowledge is not beneficial for all, it would result in destruction, crimes and miseries. Such a knowledge is actually no knowledge or ignorance i.e. agyan. With great and beneficial knowledge only one can get enlightened and inspired for welfare acts by combining his great knowledge and righteous activities i.e. gyan and karma. formula 1 gyan + karma = yajna (sacrifices) for great returns agyan + karma = crimes for punishments formula 2 Great Knowledge is purity, ignorance thereof is impurity  "," Make your life saras i.e. equally beneficial for all. It will prove that you have saraswati, the great and beneficial knowledge. Then perform your activities. Returns of saraswati are in multiples of investment.  "
Rigveda,1.3.11,Chodayitrii suunritaanaam chetantii sumatiinaam  Yajnam dadhe saraswatii.," Chodayitrii :  Inspirer, entering into mind suunritaanaam : sweet and truthful, sincere and kind chetantii : creating consciousness sumatiinaam : of right minded intellect and knowledge Yajnam : welfare activities dadhe : giver, holder saraswatii : the great and equally beneficial knowledge   None None None None None"," How Saraswati holds yajnas, the welfare activities? Saraswati, the great and beneficial knowledge equally for all, is the inspirer of sweet and truthful speech from within by entering into mind. It creates consciousness in right minded intellects. Thus, saraswati purifies the mind, speech and all activities of sense organs, thereby, leading a person to perform all welfare activities only. Thus, saraswati is the holder of yajnas.  "," Saraswati, the great knowledge and equally beneficial  for all,  inspires from within, creates a consciousness of the level of great men and holds welfare activities. Result of such a course, in any field of life, is automatic. Such a person is uplifted in the society, in the eyes of people as well as on the path of God realisation.  "
Rigveda,1.3.12,Maho arnah saraswatii prachetyati ketunaa  Dhiyo vishva viraajati.," Maho :  The great, vast arnah : ocean saraswatii : great and beneficial knowledge prachetyati : enlightens, inspirers ketunaa : with the intellect and pure activities dhiyo vishva : all intellects, minds viraajati : are influenced.   None None None None None"," How Saraswati rules the world? Saraswati is equated with vast ocean. Just as ocean is the source of diamonds etc. saraswati also is the ocean of words and thoughts and can produce great results by enlightening the intellect and pure activities. Thus, only saraswati, the great knowledge, rules the society.  "," How can our simple knowledge become saraswati? By worshipping and glorifying saraswati, the great and beneficial knowledge, followed by pure welfare activities, you can rule over the hearts of people all around, at home, workplace or society. We can make our simple knowledge also as saraswati by making it equally beneficial for all.   Rigveda Mandal-1, Hymn-4  "
